27,Brain MRI Segmentation,Brain MRI Segmentation,"The Brain MRI Segmentation model is designed to accurately segment FLAIR abnormality regions in brain MR images. With the help of the brain MRI dataset, which contains images of lower-grade glioma patients with manual segmentation masks, the model can identify and isolate regions of abnormality in the brain. The model can be used as a tool for assisting medical professionals in diagnosing and treating brain tumors, improving patient outcomes and quality of life.",Segment FLAIR abnormality regions in brain MR images,Healthcare,Image,Segmentation,https://internal.dedicated.h2o.ai/instance/d224ed57-7fb7-4d9e-a877-2de6681f4303/,s3://apac-cds/ht_datasets/image_segmentation/lgg-mri-segmentation_v1.zip,Laksika,HT,https://www.kaggle.com/datasets/mateuszbuda/lgg-mri-segmentation,CC BY-NC-SA 4.1,1373 train images with it's segmentation mask,,,,https://drive.google.com/drive/folders/1MKlG7wEbfBEjmmKd2PJXXJ8aysDaJ9Js?usp=share_link,,,,,,,,,
28,Casting Defect Classification,Casting Defect Classification,"Casting Defect Classification model uses computer vision techniques to classify images of casting defects into their respective categories. By accurately identifying and classifying the defects, manufacturers can detect and prevent them during the casting process, leading to better product quality and reduced waste. The model can be used as a tool for quality control and inspection in the manufacturing industry.",Accurately detect and classify the casting defects.,Manufacturing,Image,Classification,https://internal.dedicated.h2o.ai/instance/d224ed57-7fb7-4d9e-a877-2de6681f4303/,s3://apac-cds/ht_datasets/image_classification/casting_defect_classification.zip,Laksika,HT,https://www.kaggle.com/datasets/ravirajsinh45/real-life-industrial-dataset-of-casting-product,Attribution 4.0 International (CC BY 4.0),1300 images with labels. such as def or ok,,,,https://drive.google.com/drive/folders/1tL1tDW1AjiSApPjcJKonI6Wif8P2yVhV?usp=share_link,,,,,,,,,
29,Crowd Counting,Crowd Counting in public,"Crowd counting model is designed to estimate the number of people in a given area or image using computer vision techniques. It is commonly used in various applications such as public safety, crowd management, and event planning. ",Estimate the number of people in a given area,AI for Good,Image,Regression,https://internal.dedicated.h2o.ai/instance/d224ed57-7fb7-4d9e-a877-2de6681f4303/,s3://apac-cds/ht_datasets/image_regression/crowd_counting.zip,Laksika,HT,https://www.kaggle.com/datasets/fmena14/crowd-counting,Unknown,2000 images with their value,,,,https://drive.google.com/drive/folders/1MyXJkTj1pZ-QJLi06vMVG5INjKx5FTtr?usp=share_link,,,,,,,,,
30,Stamp Detection,Stamp Detection in documents,"Stamp detection model is designed to detect stamps from images using computer vision techniques. With the help of stamp datasets containing images of different stamps, the model can accurately identify and localize the stamps in the input image. The model can be used for various applications, such as stamp authentication and sorting, postal services, and philately. It employs object detection algorithms, including convolutional neural networks and feature extraction methods to recognize and segment the stamps from the background.",Detect Stamps in Documents using Object Detection Techniques,Banking,Image,Segmentation,https://internal.dedicated.h2o.ai/instance/d224ed57-7fb7-4d9e-a877-2de6681f4303/,s3://apac-cds/ht_datasets/image_segmentation/stamp_detection.zip,Laksika,HT,https://www.kaggle.com/datasets/rtatman/stamp-verification-staver-dataset,Unknown,400 images with their coordinates,,,,https://drive.google.com/drive/folders/1ANqfA3KqSnrc6U7y3aqwuTy2P_GXNJxe?usp=share_link,,,,,,,,,
31,ASL Alphabet Detection,ASL Alphabet Classification,"The ASL Alphabet Detection model is designed to accurately recognize and classify the American Sign Language (ASL) alphabet letters from images. The model uses a convolutional neural network (CNN) architecture and is trained on a dataset of ASL alphabet images to learn the distinctive features of each letter. The model can be used to help individuals with hearing or speech impairments to communicate more effectively by accurately recognizing and interpreting their hand signs. Additionally, the model can be used in educational settings to teach ASL or in research for sign language recognition",Accurately recognize and classify the American Sign Language (ASL) alphabet letters from images.,AI for Good,Image,Classification,https://internal.dedicated.h2o.ai/instance/d224ed57-7fb7-4d9e-a877-2de6681f4303/,s3://apac-cds/ht_datasets/image_classification/asl_alphabet_train.zip,Laksika,HT,https://www.kaggle.com/datasets/grassknoted/asl-alphabet,GPL 2,"87000 train data with their 29 different labels (A-Z,del,nothing,space)",,,,https://drive.google.com/drive/folders/1XPIILs9rjRYKSW--2f9GCkb3LD_oXijJ?usp=share_link,,,,,,,,,
32,Crop Classification,Crop Classification,"Crop classification model is an image classification model designed to identify different types of crops in an agricultural field using computer vision techniques. By analyzing the visual features of crops in the images, the model can accurately classify them into different categories, such as wheat, corn, soybean, and more. This model can be used in precision agriculture to monitor crop growth, yield, and health, and to make informed decisions for crop management.",Identify different types of crops in an agricultural field,Agriculture / AI for Good,Image,Classification,https://internal.dedicated.h2o.ai/instance/d224ed57-7fb7-4d9e-a877-2de6681f4303/,s3://apac-cds/ht_datasets/image_classification/Agricultural-crops.zip,Laksika,HT,https://www.kaggle.com/datasets/mdwaquarazam/agricultural-crops-image-classification,CC0: Public Domain,829 train images with 30 different classes,,,,https://drive.google.com/drive/folders/1uyFoE9sslbiWj0FInYfSXz1ObRv2szOi?usp=share_link,,,,,,,,,
33,Road Detection,Road Detection in urban areas,"Road detection models are essential for various applications, such as urban planning, transportation management, and autonomous driving. In urban areas, where roads can be complex and diverse, road detection from satellite images is a challenging task. This is because satellite images may contain various objects and features, such as buildings, trees, and cars, which can interfere with road detection. To overcome these challenges, the road detection model uses image processing techniques and machine learning algorithms to accurately identify and classify road segments in urban areas. The model can be trained on large datasets of satellite images labeled with road and non-road segments, and it can then be used to classify new satellite images for road detection applications.",Detect the roads in urban areas,AI for Good,Image,Segmentation,https://internal.dedicated.h2o.ai/instance/d224ed57-7fb7-4d9e-a877-2de6681f4303/,s3://apac-cds/ht_datasets/image_segmentation/road_data.zip,Laksika,HT,https://www.kaggle.com/datasets/balraj98/deepglobe-road-extraction-dataset,,"6226 train images with class id ''road""",,,,https://drive.google.com/drive/folders/1SproEy4RNDvh4LxSUNtHjr4H47o9Jnfz?usp=share_link,,,,,,,,,
34,Weather Classification,Weather Classification,"A Weather Classification model is a type of image classification model that can categorize different weather conditions based on input images. The model can be trained on datasets of images that represent various weather conditions, such as sunny, cloudy, rainy, snowy, foggy, and stormy. Once the model is trained, it can be used to classify new images of weather conditions with high accuracy, which can be useful for a variety of applications such as weather forecasting, climate modeling, and transportation safety.",Identify and Classify the weather,AI for Good,Image,Classification,https://internal.dedicated.h2o.ai/instance/d224ed57-7fb7-4d9e-a877-2de6681f4303/,s3://apac-cds/ht_datasets/image_classification/weather_classification.zip,Laksika,HT,https://www.kaggle.com/datasets/vijaygiitk/multiclass-weather-dataset,CC0: Public Domain,"1491 train images with 6 labels. such as alien_test,cloudy,foggy,rainy,shine,sunrise,",,,,https://drive.google.com/drive/folders/15jk5N8ptYBVIgs7GHiA_o-hy0CfIrRRm?usp=share_link,,,,,,,,,
35,Wind Turbines Object Detection,Wind Turbines Object Detection,"A Wind Turbines Object Detection model is used to identify and locate wind turbines in images. The model uses deep learning algorithms and image processing techniques to detect the presence and location of wind turbines in the image. It can be used for various applications such as renewable energy planning, maintenance scheduling, and environmental impact assessment. The model works by analyzing the image pixel by pixel and identifying patterns and shapes that resemble wind turbines. ",Detect the wind turbines using object detection techniques,AI for Good,Image,Object Detection,https://internal.dedicated.h2o.ai/instance/d224ed57-7fb7-4d9e-a877-2de6681f4303/,s3://apac-cds/ht_datasets/object_detection/wind_turbines_detection.zip,Laksika,HT,https://www.kaggle.com/datasets/kylegraupe/wind-turbine-image-dataset-for-computer-vision,CC0: Public Domain,2628 train images with their class ids,,,,https://drive.google.com/drive/folders/1XD21KRBRmwSCcXg1rmJ_SxNk3RK5PShB?usp=share_link,,,,,,,,,
36,Skin Cancer Segmentation,Skin Cancer Segmentation,"A Skin Cancer image Segmentation model is a powerful tool for accurately detecting and segmenting skin lesions in medical images. By analyzing the images with advanced machine learning algorithms, the model can accurately identify and isolate the cancerous regions from the rest of the skin. This helps in early detection and diagnosis of skin cancer, which is crucial for effective treatment and prevention. The model can be used in hospitals, clinics, and other medical facilities to assist dermatologists and other healthcare professionals in diagnosing skin cancer.",Accurately detecting and segmenting skin lesions in medical images,Healthcare,Image,Segmentation,https://internal.dedicated.h2o.ai/instance/d224ed57-7fb7-4d9e-a877-2de6681f4303/,s3://apac-cds/ht_datasets/image_segmentation/skin_cancer_segmentation.zip,Laksika,HT,https://www.kaggle.com/datasets/surajghuwalewala/ham1000-segmentation-and-classification,Attribution 4.0 International (CC BY 4.0),10015 train images with their masks,,,,https://drive.google.com/drive/folders/1ggyuWEl2JPsi3-A-JePxPCagqConEwKP?usp=share_link,,,,,,,,,
37,Bird Voice Classification,Bird Voice Classification,"The Bird Voice Classification model is a machine learning model designed to identify and classify bird species based on their vocalizations. By analyzing bird calls and songs, the model can accurately identify different bird species and distinguish them from one another. This model can be useful for ecological studies, birdwatching, and conservation efforts, as it can provide information about the presence and abundance of different bird species in an area. Additionally, the model can be used to track changes in bird populations over time and monitor the impact of environmental factors on bird behavior and vocalizations.",Accurately identify the bird by using it's voice,AI for Good,Audio,Classification,https://internal.dedicated.h2o.ai/instance/d224ed57-7fb7-4d9e-a877-2de6681f4303/,s3://apac-cds/ht_datasets/audio_classification/whale_detection.zip,Laksika,HT,https://www.kaggle.com/datasets/soumendraprasad/sound-of-114-species-of-birds-till-2022,CC0: Public Domain,5407 train images and 687 test images with 41 uniques labels,,,,https://drive.google.com/drive/folders/10uXWLm6emHmvRq-rYv0BP7fXAfJdpOtJ?usp=share_link,,,,,,,,,
38,Urban Sound Classification,Urban Sound Classification,"The Urban Sound Classification model is designed to classify audio signals into different sound categories commonly heard in urban environments such as sirens, car horns, and street music. The model uses audio signal processing techniques and machine learning algorithms to extract features such as frequency, pitch, and amplitude from audio samples and then trains a classifier to recognize patterns in these features and categorize them into their respective sound classes. The model has applications in noise pollution monitoring, city planning, and urban soundscape analysis.",Classify audio signals into different sound categories commonly heard in urban environments,AI for Good,Audio,Classification,https://internal.dedicated.h2o.ai/instance/d224ed57-7fb7-4d9e-a877-2de6681f4303/,s3://apac-cds/ht_datasets/audio_classification/urban_sound_classification.zip,Laksika,HT,https://www.kaggle.com/datasets/huseyngorbani1/urbansound8k,CC BY-NC 3.0,8732 train images with 10 uniques labels,,,,https://drive.google.com/drive/folders/1z-AJJJVqWXoaH0K1n8dbINfEOjllRSFA?usp=share_link,,,,,,,,,
39,Printer Defect Detection,Printer Defect Detection,"The Printer Defect Detection model uses the provided dataset to identify and classify anomalies in 3D printer operations. The dataset contains two categories: defected and non-defected. Using machine learning algorithms and image processing techniques, the model can accurately detect defects in the printer operation and classify them accordingly. This model can be useful in the quality control of 3D printing processes, allowing for early detection and correction of defects, and improving the overall efficiency of the printing process.",Detect malicious defects in 3D printer operations,AI for Good,Image,Classification,https://internal.dedicated.h2o.ai/instance/d224ed57-7fb7-4d9e-a877-2de6681f4303/,s3://apac-cds/ht_datasets/image_classification/3D_printer_defect_classification.zip,Laksika,HT,https://www.kaggle.com/datasets/justin900429/3d-printer-defected-dataset,CC BY-NC-SA 4.0,1507 train images with defected or no_defected labels,,,,https://drive.google.com/drive/folders/1Jy-UFtqMloFsOT9mivuorpZ_ECiEIBqF?usp=share_link,,,,,,,,,
40,AI Generated Image Detection,AI Generated Image Detection,"An AI Generated Image Detection model is designed to classify whether an image is generated by an AI or not. With the increasing use of generative models such as GANs and StyleGANs, it has become difficult to distinguish between real and AI-generated images. The model uses machine learning algorithms to identify specific features and patterns that are commonly found in AI-generated images, such as unusual color gradients and pixelation. By accurately classifying images as AI-generated or not, the model can be useful in detecting fake images and preventing their spread. This can be particularly important in areas such as journalism and forensics where the authenticity of images is crucial.",Classify whether an image is generated by an AI or not,AI for Good,Image,Classification,https://internal.dedicated.h2o.ai/instance/d224ed57-7fb7-4d9e-a877-2de6681f4303/,s3://apac-cds/ht_datasets/image_classification/ai-generated-image-detection.zip,Laksika,HT,https://www.kaggle.com/datasets/birdy654/cifake-real-and-ai-generated-synthetic-images,MIT License,100000 train images and 20000 test images with 2 labels [ fake or real ],,,,https://drive.google.com/drive/folders/1L7JU-iE6z9du3lv4xr093nZWOs4PA1Hj?usp=share_link,,,,,,,,,
41,Lane Detection for Driving,Lane Detection for Driving,"Lane detection for driving is a technique used in autonomous vehicles to identify and track the lanes on the road. This is done using image segmentation, where the lanes are isolated from the rest of the image. The lane detection model analyzes the input image, identifies the lane markers, and generates an output image with the lane markers highlighted. This information is then used by the autonomous vehicle to maintain its position within the lane and navigate the road safely. Lane detection is a critical component of autonomous driving, as it helps ensure the safety of passengers and other drivers on the road.",Identify and segment the lanes on the road.,AI for Good,Image,Segmentation,https://internal.dedicated.h2o.ai/instance/d224ed57-7fb7-4d9e-a877-2de6681f4303/,s3://apac-cds/ht_datasets/image_segmentation/lane-detection.zip,Laksika,HT,https://www.kaggle.com/datasets/thomasfermi/lane-detection-for-carla-driving-simulator,CC BY-NC-SA 4.0,3075 train images and 129 test images with 3 uniques segmentation labels ['left-lane' 'right-lane' 'background'],,,,https://drive.google.com/drive/folders/1ewJgl39t32vBhnWpOcXGe3t2rPWz__QN?usp=share_link,,,,,,,,,
42,Audio Emotion Detection,Audio Emotion Detection,"Audio Emotion Detection model is designed to recognize human emotions from audio signals. With the help of various audio datasets, the model can be trained to identify different emotions such as happiness, sadness, anger, fear, and more. This technology can be applied in various industries such as entertainment, healthcare, and customer service to improve user experience and engagement. For example, in the entertainment industry, the model can be used to recommend music playlists based on the user's mood. In healthcare, the model can be used to detect emotions in patients' voices and provide personalized treatment plans accordingly. Similarly, in customer service, the model can be used to detect the customer's emotions during a call and provide customized solutions to improve customer satisfaction.",Classify human emotions from audio signals,AI for Good,Audio,Classification,https://internal.dedicated.h2o.ai/instance/d224ed57-7fb7-4d9e-a877-2de6681f4303/,s3://apac-cds/ht_datasets/audio_classification/audio_emotion_detection.zip,Laksika,HT,https://www.kaggle.com/datasets/suso172/arabic-natural-audio-dataset,CC BY-NC-SA 4.0,"12798 train images with 7 uniques labels [Angry, Disgusted, Fearful,Happy,Neutral,Sad,Suprised]",,,,https://drive.google.com/drive/folders/1OBF4XaEVKoF4X9rIe4eSMmvhiXS5OnTI?usp=share_link,,,,,,,,,
43,Document Classification,Document Classification,"A Document Classification model is a machine learning model that can automatically classify different types of documents based on their content. In this case, the model is trained to classify documents into three categories: emails, scientific papers, and letters. The model analyzes the text and structure of each document and assigns it to the appropriate category based on patterns and features it has learned from a large training dataset. This model can be useful for businesses and organizations that deal with large volumes of documents and need to organize them efficiently",Classify different types of documents based on their content,AI for Good,Image,Classification,https://internal.dedicated.h2o.ai/instance/d224ed57-7fb7-4d9e-a877-2de6681f4303/,s3://apac-cds/ht_datasets/image_classification/document_classification.zip,Laksika,HT,https://www.kaggle.com/datasets/ritvik1909/document-classification-dataset,CC0: Public Domain,"165 train images with 3 uniques labels [scientific_publication, email, resume]",,,,https://drive.google.com/drive/folders/16GpXXuVOeTYkou1-bEouE9_mfV_GJbJL?usp=share_link,,,,,,,,,
44,Germination Seedling Detection,Germination Seedling Detection,"Germination Seedling Detection is a computer vision model that is designed to detect and classify seedlings at different stages of growth. This model uses image processing techniques to analyze images of seedlings and classify them based on their growth stage. The model can be used in a variety of applications, such as monitoring crop growth, identifying plant diseases, and optimizing plant growth conditions. By accurately detecting and classifying seedlings, the model can help farmers and plant researchers make informed decisions about planting, harvesting, and plant management.",Detect Seedlings to assess quality of germination process,Agriculture / AI for Good,Image,Object Detection,https://internal.dedicated.h2o.ai/instance/d224ed57-7fb7-4d9e-a877-2de6681f4303/,s3://apac-cds/ht_datasets/object_detection/germination-seeing-detection.zip,Laksika,HT,https://www.kaggle.com/datasets/jeroencrompvoets/germination-seedling-detection,CC BY-NC-SA 4.0,451 train images with their object coordinates,,,,https://drive.google.com/drive/folders/1hizbddAAhuvOc09-JPVqHt-KXONmvupi?usp=share_link,,,,,,,,,
45,Traffic Light Detection,Traffic Light Object Detection,"A Traffic Light Detection model is designed to detect the location and state (red, yellow, or green) of traffic lights in image data. This can be useful in a variety of applications, such as autonomous driving or traffic monitoring systems. The model uses object detection techniques to locate the traffic lights in the image and then applies image segmentation to determine the color of the traffic light. The model is typically trained on large datasets of annotated images containing traffic lights, including variations in lighting conditions, weather, and perspective. Once trained, the model can accurately detect and classify traffic lights in real-world scenarios.",Detect the traffic lights in image data,AI for Good,Image,Object Detection,https://internal.dedicated.h2o.ai/instance/d224ed57-7fb7-4d9e-a877-2de6681f4303/,s3://apac-cds/ht_datasets/object_detection/traffic-light-detection.zip,Laksika,HT,https://www.kaggle.com/datasets/sovitrath/small-traffic-light-dataset-xml-format,MIT License,"1222 train images with green,red,yellow labels",,,,https://drive.google.com/drive/folders/1R8GVZNkpcstz-E2MnDtFNxn8qMGEAApk?usp=share_link,,,,,,,,,
46,Trash Detection,Trash Object Detection,"The Trash Detection and Classification model is designed to identify and classify various types of trash objects in an image. This model can help in automated waste management by detecting and segregating different types of waste for efficient recycling and disposal. The model uses image classification techniques to classify trash objects into categories such as plastic, glass, paper, metal, and organic waste. The model can be trained on a large dataset of annotated images of trash objects to improve its accuracy in detecting and classifying various types of waste. Once deployed, the model can be used in various settings such as waste sorting plants, recycling centers, and smart waste bins.",Identify and classify various types of trash objects,AI for Good,Image,Object Detection,https://internal.dedicated.h2o.ai/instance/d224ed57-7fb7-4d9e-a877-2de6681f4303/,s3://apac-cds/ht_datasets/object_detection/trash-detection.zip,Laksika,HT,https://www.kaggle.com/datasets/harshpanwar/aquatrash,CC BY-NC-SA 4.0,"369 train images with 4 unique labels {glass,paper,metal, plastic}",,,,https://drive.google.com/drive/folders/1aK4QS7zstVGq-ezrxewF1AvdPXsn7b8F?usp=share_link,,,,,,,,,
47,Hardhat Object Detection,Hardhat Object Detection,"Hardhat Object Detection model is designed to detect and classify the presence of hardhats in images. The model is based on object detection techniques that use deep learning algorithms to identify and locate objects in images. With the help of a dataset of labeled images that contain hardhats, the model can accurately detect the presence and location of hardhats in new images. This model can be useful in various applications, such as construction site monitoring, safety analysis, and worker compliance monitoring.",Detect the presence of hardhats in images,Manufacturing,Image,Object Detection,https://internal.dedicated.h2o.ai/instance/d224ed57-7fb7-4d9e-a877-2de6681f4303/,s3://apac-cds/ht_datasets/object_detection/hardhat-object-detection.zip,Laksika,HT,https://www.kaggle.com/datasets/rahulgolder/hardhat-data,CC0: Public Domain,4750 train images with their annotations,,,,https://drive.google.com/drive/folders/1kXCnPSocIDnUMJK9IwhDR7nvt--StaMz?usp=share_link,,,,,,,,,
48,Heartbeat Sound Classification,Heartbeat Sound Classification,"Heartbeat Sound Classification model is a machine learning model designed to classify heartbeat sounds into different categories such as normal heartbeat and abnormal heartbeats. The model is trained on a dataset of heartbeat sounds, which includes recordings of both healthy and unhealthy heartbeats. By analyzing the sound patterns in the recordings, the model can accurately classify the heartbeat sounds into their respective categories.The potential use cases of this model include early detection of heart problems, remote monitoring of heart health, and improving the accuracy of medical diagnoses. The model can be integrated into healthcare systems and wearable devices to provide real-time analysis of heartbeat sounds and alert medical professionals to any abnormalities.",Classify heartbeat sounds into different categories.,Healthcare,Audio,Classification,https://internal.dedicated.h2o.ai/instance/d224ed57-7fb7-4d9e-a877-2de6681f4303/,s3://apac-cds/ht_datasets/image_classification/heartbeat_sound_classification.zip,Laksika,HT,https://www.kaggle.com/datasets/kinguistics/heartbeat-sounds,CC0: Public Domain,"832 train images with their labels (artifact,extrastole,murmur,normal,unlabel)",,,,https://drive.google.com/drive/folders/1_KYfuHm5j2yG2v9DHC9bQA1s0LY55SuD?usp=share_link,,,,,,,,,
